,Analyst,Sample.ID,Sample.Tag,Notes1,Type,X434.nm,X578.nm,X730.nm,dyeV,salinity,temperature,pH_ext,pH_int,a1a2,a1a2crct,pH_is,pH_a,pH_is_crct,pH_a_crct
1,RH, Blank, no dye,0, Blank,1.00E-04,0,0,0,NA,NA,NA,NA,NA,NA,NA,NA,NA,NA
2,RH, SPHX-05212019-C1-P1-4, no dye,0, Measurement 1,0.4877,0.3354,0.3352,0,19.5366,15.8318,7.6189,7.75,0.809601634,0.809002778,7.750139295,7.617586543,7.749798792,7.617246039
3,RH, SPHX-05212019-C1-P1-4, m-cresol added,0, Measurement 2,0.9665,0.721,0.3245,100,19.5366,15.8318,7.6189,7.75,NA,NA,NA,NA,NA,NA
4,RH, SPHX-05212019-C1-P2-E, no dye,0, Measurement 1,0.4558,0.3431,0.3503,0,19.518,15.9082,7.6201,7.7487,0.815415822,0.814902434,7.752332624,7.620919196,7.752042725,7.620629297
5,RH, SPHX-05212019-C1-P2-E, m-cresol added,0, Measurement 2,0.9903,0.7775,0.3425,100,19.518,15.9082,7.6189,7.75,NA,NA,NA,NA,NA,NA
6,RH, SPHX-05212019-C1-P3-G, no dye,0, Measurement 1,0.3705,0.2501,0.2726,0,19.4983,15.9962,7.6189,7.7454,0.734833483,0.733135536,7.703266804,7.573164941,7.702206386,7.572104523
7,RH, SPHX-05212019-C1-P3-G, m-cresol added,0, Measurement 2,0.9197,0.652,0.2663,100,19.4983,15.9962,7.6189,7.75,NA,NA,NA,NA,NA,NA
